{
  "schema_version": "1.0",
  "contract_version": "1.0",
  "family": "canonical_transformer_vla",
  "revision": {
    "kind": "initial",
    "previous_version": null,
    "changes": []
  },
  "capabilities": {
    "shape_profiles": {
      "required": true,
      "cardinality": "exactly_one",
      "supported": ["static", "finite"],
      "canonicalizable": {"bounded_dynamic": "finite"}
    },
    "attention": {
      "required": true,
      "cardinality": "exactly_one",
      "supported": ["scaled_dot_product", "grouped_query"],
      "canonicalizable": {"separate_qkv_scaled_dot_product": "scaled_dot_product"}
    },
    "masks": {
      "required": true,
      "cardinality": "exactly_one",
      "supported": ["causal", "padding", "causal_and_padding", "bidirectional"],
      "canonicalizable": {"additive_causal": "causal"}
    },
    "position_encodings": {
      "required": true,
      "cardinality": "exactly_one",
      "supported": ["rotary", "learned_absolute", "sinusoidal"],
      "canonicalizable": {"separate_sin_cos_rotary": "rotary"}
    },
    "normalization": {
      "required": true,
      "cardinality": "exactly_one",
      "supported": ["rms_norm", "layer_norm"],
      "canonicalizable": {"explicit_rms_formula": "rms_norm"}
    },
    "activations": {
      "required": true,
      "cardinality": "exactly_one",
      "supported": ["gelu", "silu", "tanh"],
      "canonicalizable": {"gelu_tanh_approximation": "gelu"}
    },
    "conditioning": {
      "required": true,
      "cardinality": "exactly_one",
      "supported": ["vision_language", "vision_language_state", "timestep", "noise"],
      "canonicalizable": {"concatenated_vision_language_state": "vision_language_state"}
    },
    "action_heads": {
      "required": true,
      "cardinality": "exactly_one",
      "supported": ["direct", "flow_matching"],
      "canonicalizable": {"separate_action_projection": "direct"}
    },
    "schedules": {
      "required": true,
      "cardinality": "exactly_one",
      "supported": ["none", "euler_flow_matching"],
      "canonicalizable": {"explicit_euler_loop": "euler_flow_matching"}
    },
    "control_flow": {
      "required": true,
      "cardinality": "exactly_one",
      "supported": ["static", "finite_profile_dispatch"],
      "canonicalizable": {"bounded_unrolled_loop": "static"}
    }
  }
}
