{
  "schema_version": "1.0",
  "contract_version": "2.0",
  "family": "canonical_transformer_vla",
  "revision": {
    "kind": "breaking",
    "previous_version": "1.0",
    "changes": [
      {"capability": "masks", "kind": "changed"},
      {"capability": "position_encodings", "kind": "changed"},
      {"capability": "normalization", "kind": "changed"},
      {"capability": "activations", "kind": "changed"},
      {"capability": "conditioning", "kind": "changed"},
      {"capability": "control_flow", "kind": "additive"}
    ]
  },
  "capabilities": {
    "shape_profiles": {"required": true, "cardinality": "exactly_one", "supported": ["static", "finite"], "canonicalizable": {"bounded_dynamic": "finite"}},
    "attention": {"required": true, "cardinality": "exactly_one", "supported": ["scaled_dot_product", "grouped_query"], "canonicalizable": {"separate_qkv_scaled_dot_product": "scaled_dot_product"}},
    "masks": {"required": true, "cardinality": "one_or_more", "supported": ["causal", "padding", "causal_and_padding", "bidirectional"], "canonicalizable": {"additive_causal": "causal"}},
    "position_encodings": {"required": true, "cardinality": "one_or_more", "supported": ["rotary", "learned_absolute", "sinusoidal"], "canonicalizable": {"separate_sin_cos_rotary": "rotary"}},
    "normalization": {"required": true, "cardinality": "one_or_more", "supported": ["rms_norm", "layer_norm", "adaptive_layer_norm"], "canonicalizable": {"explicit_rms_formula": "rms_norm"}},
    "activations": {"required": true, "cardinality": "one_or_more", "supported": ["gelu", "silu", "tanh", "geglu"], "canonicalizable": {"gelu_tanh_approximation": "gelu"}},
    "conditioning": {"required": true, "cardinality": "one_or_more", "supported": ["vision_language", "vision_language_state", "timestep", "noise"], "canonicalizable": {"concatenated_vision_language_state": "vision_language_state"}},
    "action_heads": {"required": true, "cardinality": "exactly_one", "supported": ["direct", "flow_matching"], "canonicalizable": {"separate_action_projection": "direct"}},
    "schedules": {"required": true, "cardinality": "exactly_one", "supported": ["none", "euler_flow_matching"], "canonicalizable": {"explicit_euler_loop": "euler_flow_matching"}},
    "control_flow": {"required": true, "cardinality": "exactly_one", "supported": ["static", "finite_profile_dispatch", "bounded_unrolled_loop"], "canonicalizable": {}}
  }
}
